{
  "title": "[BUG CRÍTICO] Falha na detecção do link de programação do final de semana",
  "body": "## Descrição\nO programa não está conseguindo encontrar corretamente o link da programação do final de semana no site Tomada de Tempo. Em vez de buscar especificamente pelo link com a descrição \"PROGRAMAÇÃO DA TV E INTERNET\" seguida da data do final de semana, ele está tentando encontrar a programação em diversos links a partir da página inicial.\n\n## Comportamento Atual\n- O programa faz requisições para múltiplas páginas sem encontrar a programação correta\n- Não está filtrando corretamente o link específico da programação do final de semana\n- Gera tráfego desnecessário no site\n- Pode resultar em eventos incorretos ou ausência de eventos no calendário gerado\n\n## Comportamento Esperado\n1. Fazer o parse da página inicial do Tomada de Tempo\n2. Identificar o link cuja descrição é \"PROGRAMAÇÃO DA TV E INTERNET\" seguido da data do final de semana\n3. Acessar apenas essa página específica para extrair os eventos\n\n## Impacto\n- Alta prioridade: Impede a correta coleta de eventos do final de semana\n- Gera tráfego desnecessário no site\n- Pode resultar em bloqueio de IP devido a múltiplas requisições\n\n## Passos para Reproduzir\n1. Executar o script `motorsport_calendar.py`\n2. Verificar os logs de saída\n3. Observar que são feitas múltiplas requisições a páginas incorretas\n\n## Logs Relevantes\n```\n2025-08-02 21:32:11,757 - motorsport_debug - INFO - log_step:465 - 🔄 STEP: 🚀 Initializing Motorsport Calendar Generator\n2025-08-02 21:32:11,759 - motorsport_debug - INFO - log_info:503 - 📚 Loaded 15 custom category mappings\n2025-08-02 21:32:11,760 - motorsport_debug - INFO - log_info:503 - 🏷️ Loaded custom type classifications\n2025-08-02 21:32:11,760 - motorsport_debug - INFO - log_info:503 - 🎯 Category Detector initialized with dynamic learning\n2025-08-02 21:32:11,761 - motorsport_debug - DEBUG - log_debug:509 - 🔍 Discovered source: TomadaTempoSource (tomada_tempo)\n2025-08-02 21:32:11,761 - motorsport_debug - DEBUG - log_debug:509 - 📋 Available sources: ['tomada_tempo']\n2025-08-02 21:32:11,761 - motorsport_debug - DEBUG - log_debug:509 - ✅ Initialized source: Tomada de Tempo\n2025-08-02 21:32:11,761 - motorsport_debug - INFO - log_success:472 - ✅ ✅ All components initialized successfully\n2025-08-02 21:32:11,762 - motorsport_debug - INFO - log_step:465 - 🔄 STEP: 🏁 Starting motorsport calendar generation\n2025-08-02 21:32:11,762 - motorsport_debug - INFO - log_step:465 - 🔄 STEP: 📡 Step 1: Data Collection\n2025-08-02 21:32:11,762 - motorsport_debug - INFO - log_step:465 - 🔄 STEP: 🏁 Starting data collection from all sources\n2025-08-02 21:32:11,763 - motorsport_debug - DEBUG - log_debug:509 - 🎯 Target date for collection: 2025-08-01\n```\n\n## Arquivos de Log Anexados\n- `logs/debug/2025-08-02_21-32-11.log`\n- `logs/motorsport_calendar.log`\n\n## Ambiente\n- Data: 02/08/2025\n- Hora: ~21:30\n- Branch: fix/issue-3-tomada-tempo-event-detection\n\n## Tarefas\n- [ ] Atualizar o método de busca para encontrar o link correto da programação\n- [ ] Implementar filtro específico para o título \"PROGRAMAÇÃO DA TV E INTERNET\"\n- [ ] Adicionar validação da data no link\n- [ ] Atualizar testes unitários\n- [ ] Documentar o novo comportamento esperado\n\n## Critérios de Aceitação\n- [ ] O programa deve encontrar o link correto na primeira tentativa\n- [ ] Deve acessar apenas a página correta da programação\n- [ ] Deve extrair corretamente os eventos do final de semana\n- [ ] Deve lidar com casos onde o link não for encontrado",
  "labels": ["bug", "critical", "tomada-tempo", "web-scraping"],
  "assignees": [],
  "milestone": null,
  "environment": {
    "date": "02/08/2025",
    "time": "~21:30",
    "branch": "fix/issue-3-tomada-tempo-event-detection"
  },
  "attachments": [
    "logs/debug/2025-08-02_21-32-11.log",
    "logs/motorsport_calendar.log"
  ]
}
